{
  "$schema": "schemas/source_taxonomy.schema.json",
  "taxonomy_id": "altibase_answerability_source_taxonomy",
  "version": 1,
  "job_id": "J002",
  "source_boundary": {
    "selected_source_inventory": "GPTs/reports/source_inventory.md",
    "durable_root": "evals/altibase_answerability",
    "authoritative_language_rule": "Use repository-local selected sources only. When paired Korean and English Altibase manuals, release notes, patch notes, tool manuals, technical documents, or third-party guides differ, derive expected facts from the Korean source and write the benchmark record in canonical English.",
    "answer_generation_sources": [
      "GPTs/attachments/*.md",
      "allowlisted_question_projection",
      "optional_manifest_selected_gpt_instruction_draft"
    ],
    "question_generation_sources": [
      "GPTs/reports/source_inventory.md",
      "Manuals/Altibase_7.1/kor",
      "Manuals/Altibase_7.1/eng",
      "Manuals/Altibase_7.3/kor",
      "Manuals/Altibase_7.3/eng",
      "Manuals/Altibase_trunk/kor",
      "Manuals/Altibase_trunk/eng",
      "Manuals/Tools/Altibase_release/kor",
      "Manuals/Tools/Altibase_release/eng",
      "Manuals/Tools/Altibase_trunk/kor",
      "Manuals/Tools/Altibase_trunk/eng",
      "ReleaseNotes/kor",
      "ReleaseNotes/eng",
      "PatchNotes/*/kor",
      "PatchNotes/*/eng",
      "Technical Documents/kor",
      "Technical Documents/eng",
      "3rd Party Guide for Altibase/kor",
      "3rd Party Guide for Altibase/eng"
    ]
  },
  "user_levels": [
    {
      "id": "beginner",
      "definition": "New Altibase user who needs version-aware orientation, safe first checks, and basic command or SQL examples without assuming DBA background."
    },
    {
      "id": "intermediate",
      "definition": "User who understands general SQL or database operations and needs Altibase-specific syntax, objects, properties, and compatibility boundaries."
    },
    {
      "id": "advanced_operator",
      "definition": "DBA or operations engineer handling installation, configuration, replication, backup, recovery, monitoring, troubleshooting, and service-impacting changes."
    },
    {
      "id": "developer",
      "definition": "Application, API, migration, connector, or tooling user who needs driver, PSM, CLI, JDBC, ODBC, precompiler, utility, or integration details."
    },
    {
      "id": "expert",
      "definition": "User asking version-sensitive, patch-specific, cross-manual, failure-mode, or high-risk operational questions where wrong assumptions would be costly."
    }
  ],
  "source_families": [
    {
      "id": "release_notes_platform",
      "label": "Release notes and supported platform documents",
      "source_types": [
        "release_note",
        "technical_document"
      ],
      "authority": "Prefer Korean release notes and Korean Supported Platforms where present; use English release notes and platform documents for English extraction and parity checks.",
      "authoritative_path_patterns": [
        "ReleaseNotes/kor/*.md",
        "Technical Documents/kor/Supported Platforms.md"
      ],
      "supporting_path_patterns": [
        "ReleaseNotes/eng/*.md",
        "Technical Documents/eng/Supported Platforms.md"
      ],
      "attachment_files": [
        "GPTs/attachments/00_version_release_platform.md"
      ],
      "primary_domains": [
        "operations_admin",
        "properties",
        "sql_ddl_dml_datatypes",
        "views_performance_monitoring",
        "replication_cdc_security_network",
        "tools_apis_connectors_migration"
      ],
      "coverage_notes": "Use for version availability, upgrade cautions, changed defaults or ranges, new 8.1 features, tool release changes, and supported platform boundaries."
    },
    {
      "id": "patch_notes",
      "label": "Patch notes",
      "source_types": [
        "patch_note"
      ],
      "authority": "Prefer Korean patch notes for patch-level behavior; use English patch notes only as supporting extraction where available.",
      "authoritative_path_patterns": [
        "PatchNotes/*/kor/*.md"
      ],
      "supporting_path_patterns": [
        "PatchNotes/*/eng/*.md"
      ],
      "attachment_files": [
        "GPTs/attachments/00_version_release_platform.md",
        "GPTs/attachments/05_data_types_properties.md",
        "GPTs/attachments/06_data_dictionary_performance_views.md",
        "GPTs/attachments/09_replication_ha_cdc.md"
      ],
      "primary_domains": [
        "properties",
        "sql_ddl_dml_datatypes",
        "views_performance_monitoring",
        "replication_cdc_security_network",
        "errors_troubleshooting"
      ],
      "coverage_notes": "Use sparingly for patch-specific feature boundaries, changed behavior, compatibility fixes, and high-risk version caveats."
    },
    {
      "id": "getting_started_installation",
      "label": "Getting Started and Installation manuals",
      "source_types": [
        "manual"
      ],
      "authority": "Prefer Korean manuals for installation and first-run behavior; use English manuals as extraction references.",
      "authoritative_path_patterns": [
        "Manuals/Altibase_7.1/kor/Getting Started Guide.md",
        "Manuals/Altibase_7.1/kor/Installation Guide.md",
        "Manuals/Altibase_7.3/kor/Getting Started Guide.md",
        "Manuals/Altibase_7.3/kor/Installation Guide.md",
        "Manuals/Altibase_trunk/kor/Getting Started Guide.md",
        "Manuals/Altibase_trunk/kor/Installation Guide.md"
      ],
      "supporting_path_patterns": [
        "Manuals/Altibase_7.1/eng/Getting Started Guide.md",
        "Manuals/Altibase_7.1/eng/Installation Guide.md",
        "Manuals/Altibase_7.3/eng/Getting Started Guide.md",
        "Manuals/Altibase_7.3/eng/Installation Guide.md",
        "Manuals/Altibase_trunk/eng/Getting Started Guide.md",
        "Manuals/Altibase_trunk/eng/Installation Guide.md"
      ],
      "attachment_files": [
        "GPTs/attachments/01_getting_started_installation.md"
      ],
      "primary_domains": [
        "operations_admin"
      ],
      "coverage_notes": "Use for installation prerequisites, environment setup, database creation, startup, shutdown, and first health checks."
    },
    {
      "id": "administrator_operations",
      "label": "Administrator manuals and administrative SQL support",
      "source_types": [
        "manual"
      ],
      "authority": "Prefer Korean Administrator and SQL Reference manuals; use English manuals for extraction and wording parity.",
      "authoritative_path_patterns": [
        "Manuals/Altibase_7.1/kor/Administrator* Manual.md",
        "Manuals/Altibase_7.1/kor/SQL Reference.md",
        "Manuals/Altibase_7.3/kor/Administrator* Manual.md",
        "Manuals/Altibase_7.3/kor/SQL Reference.md",
        "Manuals/Altibase_trunk/kor/Administrator* Manual.md",
        "Manuals/Altibase_trunk/kor/SQL Reference.md"
      ],
      "supporting_path_patterns": [
        "Manuals/Altibase_7.1/eng/Administrator* Manual.md",
        "Manuals/Altibase_7.1/eng/SQL Reference.md",
        "Manuals/Altibase_7.3/eng/Administrator* Manual.md",
        "Manuals/Altibase_7.3/eng/SQL Reference.md",
        "Manuals/Altibase_trunk/eng/Administrator* Manual.md",
        "Manuals/Altibase_trunk/eng/SQL Reference.md"
      ],
      "attachment_files": [
        "GPTs/attachments/02_administration_operations.md",
        "GPTs/attachments/03_sql_ddl_generation.md"
      ],
      "primary_domains": [
        "operations_admin",
        "sql_ddl_dml_datatypes"
      ],
      "coverage_notes": "Use for accounts, privileges, tablespaces, backup, restore, recovery, datafiles, logs, server modes, and administrative SQL."
    },
    {
      "id": "sql_reference",
      "label": "SQL Reference manuals",
      "source_types": [
        "manual"
      ],
      "authority": "Prefer Korean SQL Reference manuals for syntax and restrictions; use English SQL Reference manuals for extraction and examples.",
      "authoritative_path_patterns": [
        "Manuals/Altibase_7.1/kor/SQL Reference.md",
        "Manuals/Altibase_7.3/kor/SQL Reference.md",
        "Manuals/Altibase_trunk/kor/SQL Reference.md"
      ],
      "supporting_path_patterns": [
        "Manuals/Altibase_7.1/eng/SQL Reference.md",
        "Manuals/Altibase_7.3/eng/SQL Reference.md",
        "Manuals/Altibase_trunk/eng/SQL Reference.md"
      ],
      "attachment_files": [
        "GPTs/attachments/03_sql_ddl_generation.md",
        "GPTs/attachments/04_sql_dml_oracle_compatibility.md",
        "GPTs/attachments/10_psm_stored_external_procedures.md",
        "GPTs/attachments/19_spatial_nifi_tableau_misc.md"
      ],
      "primary_domains": [
        "sql_ddl_dml_datatypes",
        "tools_apis_connectors_migration"
      ],
      "coverage_notes": "Use for DDL, DML, DCL, functions, expressions, hints, data type syntax, SQL generation boundaries, and Oracle-difference questions."
    },
    {
      "id": "general_reference_1_datatypes_properties",
      "label": "General Reference 1: data types and Altibase properties",
      "source_types": [
        "manual"
      ],
      "authority": "Prefer Korean General Reference 1 manuals; use English General Reference 1 manuals for extraction and English terminology.",
      "authoritative_path_patterns": [
        "Manuals/Altibase_7.1/kor/General Reference-1.Data Types & Altibase Properties.md",
        "Manuals/Altibase_7.3/kor/General*Reference-1.Data Types & Altibase Properties.md",
        "Manuals/Altibase_trunk/kor/General*Reference-1.Data Types & Altibase Properties.md"
      ],
      "supporting_path_patterns": [
        "Manuals/Altibase_7.1/eng/General Reference-1.Data Types & Altibase Properties.md",
        "Manuals/Altibase_7.3/eng/General Reference-1.Data Types & Altibase Properties.md",
        "Manuals/Altibase_trunk/eng/General Reference-1.Data Types & Altibase Properties.md"
      ],
      "attachment_files": [